Tasks,,,,,,,,,,,,,,,,,,,,,,,,,,,,,,,,,,,,,,,,,,,,,,,,,,,,,,,,,,,,,,,,,,,,,,,,,,,,,,,,
Week,1,,,,,2,,,,,3,,,,,4,,,,,5,,,,,6,,,,,7,,,,,8,,,,,9,,,,,10,,,,,11,,,,,12,,,,,13,,,,,14,,,,,15,,,,,16,,,,
Weekday,Mon,Tue,Wed,Thu,Fri,Mon,Tue,Wed,Thu,Fri,Mon,Tue,Wed,Thu,Fri,Mon,Tue,Wed,Thu,Fri,Mon,Tue,Wed,Thu,Fri,Mon,Tue,Wed,Thu,Fri,Mon,Tue,Wed,Thu,Fri,Mon,Tue,Wed,Thu,Fri,Mon,Tue,Wed,Thu,Fri,Mon,Tue,Wed,Thu,Fri,Mon,Tue,Wed,Thu,Fri,Mon,Tue,Wed,Thu,Fri,Mon,Tue,Wed,Thu,Fri,Mon,Tue,Wed,Thu,Fri,Mon,Tue,Wed,Thu,Fri,Mon,Tue,Wed,Thu,Fri
1. Project Initiation & Planning,a,a,a,a,,,,,,,,,,,,,,,,,,,,,,,,,,,,,,,,,,,,,,,,,,,,,,,,,,,,,,,,,,,,,,,,,,,,,,,,,,,,
Define project goals and success metrics,,b,,,,,,,,,,,,,,,,,,,,,,,,,,,,,,,,,,,,,,,,,,,,,,,,,,,,,,,,,,,,,,,,,,,,,,,,,,,,,,
Define project timeline and milestones,,b,,,,,,,,,,,,,,,,,,,,,,,,,,,,,,,,,,,,,,,,,,,,,,,,,,,,,,,,,,,,,,,,,,,,,,,,,,,,,,
Assign project roles and responsibilities,,b,,,,,,,,,,,,,,,,,,,,,,,,,,,,,,,,,,,,,,,,,,,,,,,,,,,,,,,,,,,,,,,,,,,,,,,,,,,,,,
"Plan stakeholder alignment meetings (CS leadership, IT/Security, Data)",,,b,,,,,,,,,,,,,,,,,,,,,,,,,,,,,,,,,,,,,,,,,,,,,,,,,,,,,,,,,,,,,,,,,,,,,,,,,,,,,
"2. Access, Security & IT Setup",,,,,a,a,a,a,,,,,,,,,,,,,,,,,,,,,,,,,,,,,,,,,,,,,,,,,,,,,,,,,,,,,,,,,,,,,,,,,,,,,,,,
"Perform access control and permissions setup (agents, leads, WFM)",,,,,b,b,,,,,,,,,,,,,,,,,,,,,,,,,,,,,,,,,,,,,,,,,,,,,,,,,,,,,,,,,,,,,,,,,,,,,,,,,,
"Security and compliance review (privacy, data handling)",,,,,b,b,b,,,,,,,,,,,,,,,,,,,,,,,,,,,,,,,,,,,,,,,,,,,,,,,,,,,,,,,,,,,,,,,,,,,,,,,,,
IT sign-off on software compatibility / whitelisting,,,,,,,,b,,,,,,,,,,,,,,,,,,,,,,,,,,,,,,,,,,,,,,,,,,,,,,,,,,,,,,,,,,,,,,,,,,,,,,,,
4. System Setup & Configuration,,,,,,,,,a,a,a,a,a,a,a,a,a,a,a,a,,,,,,,,,,,,,,,,,,,,,,,,,,,,,,,,,,,,,,,,,,,,,,,,,,,,,,,,,,,,
Clean and validate legacy data before import,,,,,,,,,b,b,b,,,,,,,,,,,,,,,,,,,,,,,,,,,,,,,,,,,,,,,,,,,,,,,,,,,,,,,,,,,,,,,,,,,,,
Data import & initial system setup,,,,,,,,,,,,b,b,b,,,,,,,,,,,,,,,,,,,,,,,,,,,,,,,,,,,,,,,,,,,,,,,,,,,,,,,,,,,,,,,,,,
Integration of data connectors to data warehouse,,,,,,,,,,,,,b,b,b,,,,,,,,,,,,,,,,,,,,,,,,,,,,,,,,,,,,,,,,,,,,,,,,,,,,,,,,,,,,,,,,,
Design data dictionary for future export/reporting,,,,,,,,,,,,,b,b,b,,,,,,,,,,,,,,,,,,,,,,,,,,,,,,,,,,,,,,,,,,,,,,,,,,,,,,,,,,,,,,,,,
Import absence data from old software,,,,,,,,,,,,,,,,b,b,b,,,,,,,,,,,,,,,,,,,,,,,,,,,,,,,,,,,,,,,,,,,,,,,,,,,,,,,,,,,,,,
Queue/channel-level configuration (chat vs. email vs. phone),,,,,,,,,,,,,,,,b,b,b,,,,,,,,,,,,,,,,,,,,,,,,,,,,,,,,,,,,,,,,,,,,,,,,,,,,,,,,,,,,,,
Skill & proficiency tagging (for skill-based routing),,,,,,,,,,,,,,,,,,,b,b,,,,,,,,,,,,,,,,,,,,,,,,,,,,,,,,,,,,,,,,,,,,,,,,,,,,,,,,,,,,
3. Testing & Validation,,,,,,,,,,,,,,,,a,a,a,a,a,,,,,,,,,,,,,,,,,,,,,,,,,,,,,,,,,,,,,,,,,,,,,,,,,,,,,,,,,,,,
User Acceptance Testing (UAT) with subset of users,,,,,,,,,,,,,,,,,,b,b,,,,,,,,,,,,,,,,,,,,,,,,,,,,,,,,,,,,,,,,,,,,,,,,,,,,,,,,,,,,,
"Integration testing (connectors to ticketing, CRM, telephony)",,,,,,,,,,,,,,,,b,b,,,,,,,,,,,,,,,,,,,,,,,,,,,,,,,,,,,,,,,,,,,,,,,,,,,,,,,,,,,,,,,
Backup and rollback plan testing,,,,,,,,,,,,,,,,b,b,,,,,,,,,,,,,,,,,,,,,,,,,,,,,,,,,,,,,,,,,,,,,,,,,,,,,,,,,,,,,,,
"Monitoring tools setup (uptime tracking, error logging)",,,,,,,,,,,,,,,,,,b,b,b,,,,,,,,,,,,,,,,,,,,,,,,,,,,,,,,,,,,,,,,,,,,,,,,,,,,,,,,,,,,
5. Experimentation & Process Design,,,,,,,,,,,,,,,,,,,,,a,a,a,a,a,a,a,a,a,a,a,a,a,a,a,a,a,a,a,a,a,a,a,a,a,,,,,,,,,,,,,,,,,,,,,,,,,,,,,,,,,,,
Experimentation: Forecasting & scheduling,,,,,,,,,,,,,,,,,,,,,b,b,b,b,b,b,b,b,b,b,b,b,,,,,,,,,,,,,,,,,,,,,,,,,,,,,,,,,,,,,,,,,,,,,,,,
Experimentation: Holiday planning & processes,,,,,,,,,,,,,,,,,,,,,,,,,,b,b,b,b,b,b,b,b,b,b,b,b,,,,,,,,,,,,,,,,,,,,,,,,,,,,,,,,,,,,,,,,,,,
Define & document forecasting/scheduling processes,,,,,,,,,,,,,,,,,,,,,,,,,,,,,,,b,b,b,b,b,b,b,b,b,b,,,,,,,,,,,,,,,,,,,,,,,,,,,,,,,,,,,,,,,,
Define & document holiday planning processes,,,,,,,,,,,,,,,,,,,,,,,,,,,,,,,,,,,,b,b,b,b,b,,,,,,,,,,,,,,,,,,,,,,,,,,,,,,,,,,,,,,,,
"Set up automation rules (e.g., breaks, adherence alerts)",,,,,,,,,,,,,,,,,,,,,,,,,,b,b,b,b,b,b,b,b,b,b,b,b,b,b,b,,,,,,,,,,,,,,,,,,,,,,,,,,,,,,,,,,,,,,,,
Set up wfm dashboard,,,,,,,,,,,,,,,,,,,,,,,,,,,,,,,,,,,,b,b,b,b,b,b,b,b,b,b,,,,,,,,,,,,,,,,,,,,,,,,,,,,,,,,,,,
6. Training & Communication,,,,,,,,,,,,,,,,,,,,,,,,,,,,,,,,,,,,,,,,,a,a,a,a,a,a,a,a,a,a,a,a,a,a,a,a,a,a,a,a,a,a,a,a,a,a,a,a,a,,,,,,,,,,,
Create training materials for CS employees,,,,,,,,,,,,,,,,,,,,,,,,,,,,,,,,,,,,,,,,,b,b,b,b,b,,,,,,,,,,,,,,,,,,,,,,,,,,,,,,,,,,,
Train CS employees,,,,,,,,,,,,,,,,,,,,,,,,,,,,,,,,,,,,,,,,,,,,,,,,b,b,,,,,,,,,b,b,,,,,,,,,b,b,,,,,,,,,,,
"Inform all stakeholders of roll-out date (IT, CS, Data, C-level)",,,,,,,,,,,,,,,,,,,,,,,,,,,,,,,,,,,,,,,,,,,,b,,,,,,,,,,,,,,,,,,,,,,,,,,,,,,,,,,,,
Create knowledge base for CS employees,,,,,,,,,,,,,,,,,,,,,,,,,,,,,,,,,,,,,,,,,,,b,b,b,b,b,b,b,b,b,b,,,,,,,,,,,,,,,,,,,,,,,,,,,,
Create knowledge base for WFM employees,,,,,,,,,,,,,,,,,,,,,,,,,,,,,,,,,,,,,,,,,,,b,b,b,b,b,b,b,b,b,b,b,b,b,,,,,,,,,,,,,,,,,,,,,,,,,
Create Slack channels for real-time support during rollout,,,,,,,,,,,,,,,,,,,,,,,,,,,,,,,,,,,,,,,,,,,,,,,,,,,b,,,,,,,,,,,,,,,,,,,,,,,,,,,,,
7. Transition & Scheduling Team 1,,,,,,,,,,,,,,,,,,,,,,,,,,,,,,,,,,,,,,,,,,,,,,,,,,,,a,a,a,a,a,a,a,,,,,,,,,,,,,,,,,,,,,,
Create schedules for upcoming 4 weeks in both old & new systems,,,,,,,,,,,,,,,,,,,,,,,,,,,,,,,,,,,,,,,,,,,,,,,,,,,,b,b,b,,,,,,,,,,,,,,,,,,,,,,,,,,
Create backup schedules for emergencies,,,,,,,,,,,,,,,,,,,,,,,,,,,,,,,,,,,,,,,,,,,,,,,,,,,,,,,b,b,,,,,,,,,,,,,,,,,,,,,,,,
connect existing dashboards to new data source,,,,,,,,,,,,,,,,,,,,,,,,,,,,,,,,,,,,,,,,,,,,,,,,,,,,,,,,,,b,,,,,,,,,,,,,,,,,,,,,,
Go-Live Team 1,,,,,,,,,,,,,,,,,,,,,,,,,,,,,,,,,,,,,,,,,,,,,,,,,,,,,,,,,,b,,,,,,,,,,,,,,,,,,,,,,
7. Transition & Scheduling Teams 2-5,,,,,,,,,,,,,,,,,,,,,,,,,,,,,,,,,,,,,,,,,,,,,,,,,,,,,,,,,,,a,a,a,a,a,a,a,a,a,a,,,,,,,,,,,,
Create schedules for upcoming 4 weeks in both old & new systems,,,,,,,,,,,,,,,,,,,,,,,,,,,,,,,,,,,,,,,,,,,,,,,,,,,,,,,,,,,b,b,b,b,b,,,,,,,,,,,,,,,,,
Create backup schedules for emergencies,,,,,,,,,,,,,,,,,,,,,,,,,,,,,,,,,,,,,,,,,,,,,,,,,,,,,,,,,,,,,,,,b,b,b,,,,,,,,,,,,,,
connect existing dashboards to new data source,,,,,,,,,,,,,,,,,,,,,,,,,,,,,,,,,,,,,,,,,,,,,,,,,,,,,,,,,,,,,,,,,,,,b,,,,,,,,,,,,
Go-Live Teams 2-5,,,,,,,,,,,,,,,,,,,,,,,,,,,,,,,,,,,,,,,,,,,,,,,,,,,,,,,,,,,,,,,,,,,,b,,,,,,,,,,,,
7. Transition & Scheduling Teams 6-8,,,,,,,,,,,,,,,,,,,,,,,,,,,,,,,,,,,,,,,,,,,,,,,,,,,,,,,,,,,,,,,,,,a,a,a,a,a,a,a,a,,,,,,,
Create schedules for upcoming 4 weeks in both old & new systems,,,,,,,,,,,,,,,,,,,,,,,,,,,,,,,,,,,,,,,,,,,,,,,,,,,,,,,,,,,,,,,,,,b,b,b,b,,,,,,,,,,,
Create backup schedules for emergencies,,,,,,,,,,,,,,,,,,,,,,,,,,,,,,,,,,,,,,,,,,,,,,,,,,,,,,,,,,,,,,,,,,,,,,b,b,b,,,,,,,,
connect existing dashboards to new data source,,,,,,,,,,,,,,,,,,,,,,,,,,,,,,,,,,,,,,,,,,,,,,,,,,,,,,,,,,,,,,,,,,,,,,,,,b,,,,,,,
Go-Live Teams 6-8,,,,,,,,,,,,,,,,,,,,,,,,,,,,,,,,,,,,,,,,,,,,,,,,,,,,,,,,,,,,,,,,,,,,,,,,,b,,,,,,,
8. Post-Rollout & Monitoring,,,,,,,,,,,,,,,,,,,,,,,,,,,,,,,,,,,,,,,,,,,,,,,,,,,,,,,,a,a,a,a,a,a,a,a,a,a,a,a,a,a,a,a,a,a,a,a,a,a,a,a,a
"Archive old processes, request forms, knowledge base articles",,,,,,,,,,,,,,,,,,,,,,,,,,,,,,,,,,,,,,,,,,,,,,,,,,,,,,,,,,,,,,,,,,,,,,,,,,b,,,,,,
"First-week hypercare support (questions, fixes)",,,,,,,,,,,,,,,,,,,,,,,,,,,,,,,,,,,,,,,,,,,,,,,,,,,,,,,,,,b,b,b,b,b,b,,,,,b,b,b,b,b,b,b,b,b,b,b,,
Weekly stakeholder check-ins (first 4 weeks),,,,,,,,,,,,,,,,,,,,,,,,,,,,,,,,,,,,,,,,,,,,,,,,,,,,,,,,,,,,,,b,,,,,b,,,,,b,,,,,b,,,
"Post-implementation review (what went well, areas for improvement)",,,,,,,,,,,,,,,,,,,,,,,,,,,,,,,,,,,,,,,,,,,,,,,,,,,,,,,,,,,,,,,,,,,,,,,,,,,,,,,b,
Track KPIs post-rollout (compare pre-/post- rollout metrics),,,,,,,,,,,,,,,,,,,,,,,,,,,,,,,,,,,,,,,,,,,,,,,,,,,,,,,,,,,,,,,,,,,,,,,,,,,,b,b,b,b,b
Plan for future features or integrations,,,,,,,,,,,,,,,,,,,,,,,,,,,,,,,,,,,,,,,,,,,,,,,,,,,,,,,,,,,,,,,,,,,,,,,,,,,,,,,,